{
  "schema_name": "phase1_candidate_threads",
  "schema_version": "1.0",
  "package_type": "thread_discovery_candidates",
  "source_window": {
    "window_id": "window_001",
    "start_week": 1,
    "end_week": 10,
    "week_count": 10,
    "week_numbers": [1, 2, 3, 4, 5, 6, 7, 8, 9, 10]
  },
  "build": {
    "created_at": "2026-03-09T10:00:00Z",
    "created_by": "assistant",
    "model": "gpt-5.4-thinking",
    "run_id": "phase1_window_001_manual_001",
    "prompt_version": "1.0"
  },
  "candidate_threads": [
    {
      "candidate_id": "cand_ADMIN_STATE_CAPTURE",
      "canonical_name": "Administrative State Capture via DOGE and Civil-Service Purge",
      "short_name": "Administrative State Capture",
      "description": "Executive centralization of the federal bureaucracy through DOGE, civil-service purges, agency hollowing, politicized personnel control, and capture of payment and operating systems.",
      "scope_level": "thread",
      "supporting_weeks": [1, 2, 3, 4, 5, 6],
      "supporting_developments": [
        {
          "week_number": 1,
          "development_id": "D7",
          "development_title": "Civil service, oversight, and agencies are politicized and partially outsourced to Musk’s DOGE",
          "role": "primary",
          "why_it_supports_thread": "Introduces DOGE, Schedule F, and loyalty-driven restructuring as an early governing method."
        },
        {
          "week_number": 2,
          "development_id": "D2",
          "development_title": "Civil service, oversight, and labor protections are gutted to build a loyalty-based state",
          "role": "primary",
          "why_it_supports_thread": "Shows the project expanding into HR data, watchdog removals, and destruction of labor and oversight protections."
        },
        {
          "week_number": 3,
          "development_id": "D3",
          "development_title": "Musk’s DOGE apparatus and Trump loyalists capture the administrative state and federal payment infrastructure",
          "role": "primary",
          "why_it_supports_thread": "Makes explicit the move from staffing and structure into payment systems and agency operations."
        },
        {
          "week_number": 4,
          "development_id": "D1",
          "development_title": "DOGE becomes a parallel executive state and spearheads a civil service purge",
          "role": "primary",
          "why_it_supports_thread": "Shows consolidation of the pattern into a parallel governing apparatus with operational reach."
        },
        {
          "week_number": 5,
          "development_id": "D1",
          "development_title": "DOGE-Driven Purge Reshapes the Federal Workforce and Public Services",
          "role": "primary",
          "why_it_supports_thread": "Continues the same logic through mass layoffs and restructuring across public-facing agencies."
        },
        {
          "week_number": 6,
          "development_id": "D1",
          "development_title": "Musk’s DOGE tightens control over federal money, data, and the civil service",
          "role": "primary",
          "why_it_supports_thread": "Confirms that DOGE is not episodic but an ongoing method of controlling money, data, and staffing."
        }
      ],
      "aliases": [
        "DOGE-driven purge",
        "parallel executive state",
        "civil service purge",
        "loyalty-based state",
        "capture of the administrative state",
        "federal payment infrastructure capture"
      ],
      "inclusion_notes": [
        "Include DOGE authority expansion, mass layoffs, buyouts, Schedule F, personnel-system control, and agency hollowing.",
        "Include capture of payment systems, HR systems, and operational levers across agencies."
      ],
      "exclusion_notes": [
        "Exclude general corruption unless directly tied to capture of state machinery.",
        "Exclude broad fiscal policy unless specifically about DOGE or bureaucratic control."
      ],
      "boundary_notes": [
        "Related to crony capitalism and private-state fusion, but focused on control of the federal apparatus itself.",
        "Related to executive overreach, but narrower and more operational."
      ],
      "related_candidate_ids": [
        "cand_CRONY_CAPITALISM_AND_PRIVATE_STATE_FUSION",
        "cand_EXECUTIVE_OVERREACH_AND_IMPOUNDMENT"
      ],
      "confidence": 0.98,
      "continuity_assessment": "sustained"
    },
    {
      "candidate_id": "cand_IMMIGRATION_AS_CONTROL",
      "canonical_name": "Immigration, Citizenship, and Asylum as Tools of Tiered Belonging and Domestic Control",
      "short_name": "Immigration as Control",
      "description": "Use of emergency powers, deportation machinery, detention, birthright attacks, and status precarity to create a stratified legal order and extend coercive state power.",
      "scope_level": "thread",
      "supporting_weeks": [1, 2, 3, 4, 5, 6],
      "supporting_developments": [
        {
          "week_number": 1,
          "development_id": "D2",
          "development_title": "Immigration, citizenship, and the border are recast as a permanent emergency",
          "role": "primary",
          "why_it_supports_thread": "Establishes the emergency framework and militarized approach to immigration and citizenship."
        },
        {
          "week_number": 2,
          "development_id": "D4",
          "development_title": "Immigration, citizenship, and protest rights are recast through mass raids and tiered status",
          "role": "primary",
          "why_it_supports_thread": "Extends the thread into raids, Guantánamo, TPS changes, and protest-linked status vulnerability."
        },
        {
          "week_number": 3,
          "development_id": "D5",
          "development_title": "Immigration, asylum, and citizenship are restructured through hardline executive orders and offshored detention",
          "role": "primary",
          "why_it_supports_thread": "Shows asylum suspension, offshore detention, and citizenship attacks as recurring methods."
        },
        {
          "week_number": 4,
          "development_id": "D5",
          "development_title": "Citizenship and public health are redefined along ideological and identity lines",
          "role": "secondary",
          "why_it_supports_thread": "Continues the thread through selective asylum, ICE operations, and identity-based access to protections."
        },
        {
          "week_number": 5,
          "development_id": "D4",
          "development_title": "Immigration and Citizenship Policy Harden Into a Tiered System of Rights",
          "role": "primary",
          "why_it_supports_thread": "Makes the status hierarchy itself the center of the weekly development."
        },
        {
          "week_number": 6,
          "development_id": "D2",
          "development_title": "Trump accelerates mass deportation and a tiered immigration regime",
          "role": "primary",
          "why_it_supports_thread": "Confirms continuity through mass-deportation ambition, surveillance, and monetized citizenship."
        }
      ],
      "aliases": [
        "permanent border emergency",
        "tiered system of rights",
        "mass deportation regime",
        "offshored detention",
        "birthright citizenship attack",
        "immigration as domestic control"
      ],
      "inclusion_notes": [
        "Include raids, detention expansion, Guantánamo use, asylum suspension, birthright citizenship attacks, TPS and status changes, and legal precarity.",
        "Include uses of immigration law against dissent, local autonomy, or public participation when clearly linked."
      ],
      "exclusion_notes": [
        "Exclude generic border rhetoric unless tied to concrete governance moves.",
        "Exclude unrelated foreign-policy migration stories without domestic coercive implications."
      ],
      "boundary_notes": [
        "Related to civil-rights rollback, but focused on status, deportability, and belonging.",
        "Related to law-as-weapon, but centered on immigration machinery rather than prosecution generally."
      ],
      "related_candidate_ids": [
        "cand_RIGHTS_ROLLBACK_AND_SOCIAL_ORDER",
        "cand_LAW_AS_WEAPON_AND_IMPUNITY"
      ],
      "confidence": 0.98,
      "continuity_assessment": "sustained"
    },
    {
      "candidate_id": "cand_LAW_AS_WEAPON_AND_IMPUNITY",
      "canonical_name": "Law Enforcement and Justice Reoriented Toward Impunity for Allies and Punishment of Opponents",
      "short_name": "Law as Weapon and Impunity",
      "description": "Repurposing DOJ, pardons, prosecutions, watchdog removals, and enforcement priorities to protect regime allies, erase accountability, and pressure perceived enemies.",
      "scope_level": "thread",
      "supporting_weeks": [1, 2, 3, 4, 5],
      "supporting_developments": [
        {
          "week_number": 1,
          "development_id": "D3",
          "development_title": "Civil rights enforcement is frozen while law is bent to protect regime-aligned causes",
          "role": "primary",
          "why_it_supports_thread": "Introduces pardons, selective clemency, and withdrawal of protections as a legal inversion."
        },
        {
          "week_number": 2,
          "development_id": "D1",
          "development_title": "Trump weaponizes law and pardons to erase January 6 accountability and shield himself",
          "role": "primary",
          "why_it_supports_thread": "Makes explicit the combination of pardons, purges, and record erasure to protect insiders."
        },
        {
          "week_number": 3,
          "development_id": "D2",
          "development_title": "Justice Department, FBI, and oversight mechanisms are purged and repurposed to shield Trump and allies",
          "role": "primary",
          "why_it_supports_thread": "Expands the pattern into DOJ, FBI, election, labor, and oversight institutions."